{
  "dynamicLoad": false,
  "currentGame": "Shelfs",
  "onlineStatus": "Online",
  "pluginDirectory": "plugins",
  "token": "token",
  "commandPrefix": "!",
  "io": "MySQL",
  "libraries": [
    {
      "group": "org.jetbrains.kotlin",
      "artifact": "kotlin-stdlib-jdk8",
      "version": "1.3.0"
    },
    {
      "group": "org.jetbrains.kotlin",
      "artifact": "kotlin-stdlib-jdk7",
      "version": "1.3.0"
    },
    {
      "group": "org.jetbrains.kotlin",
      "artifact": "kotlin-stdlib",
      "version": "1.3.0"
    },
    {
      "group": "org.jetbrains.kotlin",
      "artifact": "kotlin-stdlib-common",
      "version": "1.3.0"
    },
    {
      "group": "org.jetbrains",
      "artifact": "annotations",
      "version": "13.0"
    },
    {
      "artifact": "kotlinx-coroutines-core",
      "version": "1.0.1",
      "group": "org.jetbrains.kotlinx"
    }
  ],
  "database": {
    "ioPassword": "",
    "ioUser": "",
    "ioDb": "",
    "ioHost": "",
    "ioPort": "3306"
  }
}